{
  "$schema": "http://json-schema.org/draft-07/schema#",
  "title": "Trothix Vision Specification",
  "type": "object",
  "properties": {
    "id": {
      "type": "string"
    },
    "version": {
      "type": "string"
    },
    "purpose": {
      "type": "string"
    },
    "scope": {
      "type": "array",
      "items": {
        "type": "string"
      }
    },
    "dependencies": {
      "type": "array",
      "items": {
        "type": "string"
      }
    },
    "inputs": {
      "type": "array",
      "items": {
        "type": "string"
      }
    },
    "outputs": {
      "type": "array",
      "items": {
        "type": "string"
      }
    },
    "constraints": {
      "type": "array",
      "items": {
        "type": "string"
      }
    },
    "forbidden": {
      "type": "array",
      "items": {
        "type": "string"
      }
    },
    "future": {
      "type": "array",
      "items": {
        "type": "string"
      }
    },
    "references": {
      "type": "array",
      "items": {
        "type": "string"
      }
    }
  },
  "required": [
    "id",
    "version",
    "purpose",
    "scope",
    "dependencies",
    "inputs",
    "outputs",
    "constraints",
    "forbidden",
    "future",
    "references"
  ]
}