{
  "id": "VSN_KNOWLEDGE_GRAPH",
  "version": "1.0.0",
  "purpose": "Defines the structure of the /knowledge/ directory, storing every deterministic rule as data.",
  "scope": [
    "documents",
    "concepts",
    "actions",
    "entities",
    "phrases",
    "conditions",
    "exceptions",
    "definitions",
    "references",
    "numbers",
    "dates",
    "money",
    "relationships",
    "classifiers",
    "decision_tables",
    "findings",
    "assessments",
    "weights",
    "policies",
    "capabilities",
    "benchmarks",
    "jurisdictions",
    "industries",
    "examples"
  ],
  "dependencies": [],
  "inputs": [],
  "outputs": [],
  "constraints": [],
  "forbidden": [],
  "future": [],
  "references": []
}